timestamp,workflow_name,action,notes
10/20/25 0:00,orientation,started,Starting orientation workflow
10/20/25 0:05,orientation,profile_created,Created profile for Geeta
10/20/25 0:10,orientation,goals_set,Set personal goals for bootcamp
10/20/25 0:15,orientation,project_defined,Documented initial project idea: Research-to-Market AI Marketplace
10/20/25 0:20,orientation,complete,Orientation finished - workspace ready
10/20/25 0:25,master_orchestration,progress_check,Week 1 Day 1 check-in - just getting started10/21/25 0:00,ideation_workflow,completed,Completed full ideation workflow - generated research analysis experiment workflow with 8 steps in your_workspace/your_workflows/research_analysis_experiment/
2025-10-22 10:53:16,master_orchestration,progress_check,Week 1 Day 3 check-in - ahead of schedule: completed orientation and ideation workflows
2025-10-22 10:56:48,master_orchestration,problem_definition_update,Updated problem definition with market context pain points: 70%+ research commercialization gap, investor discovery challenges, IP office intelligence fragmentation
2025-10-22 11:37:42,master_orchestration,problem_definition_marketplace_update,Expanded problem definition to reflect full 3-stakeholder marketplace vision (researchers, investors, industry partners) with 4-phase evolution plan
2025-10-22 12:08:04,problem_definition,validation_requirements_added,Added 11-item use case validation checklist (5 core + 3 business + 3 strategic) with quality gates for marketplace readiness
2025-10-22 12:28:39,problem_definition,tiered_validation_added,Implemented 4-tier validation system: Monitoring (3 items) → Exploring (8 items) → Pilot-Ready (12 items) → Seeking Funding (14 items, investor-ready)
2025-10-22 12:40:05,experiment_workflow,tiered_validation_added,Enhanced experiment workflow with tiered validation: CP1=interest level selection, CP2=validation checklist (3/8/12/14 items), CP3=marketplace preview. Created 2 enhancement docs.
2025-10-22 13:40:43,master_orchestration,progress_check,Week 1 - 0/16 tasks complete
2025-10-22 15:05:00,research_analysis_experiment,step1_complete,Environment and API setup validated
2025-10-22 16:50:09,research_analysis_experiment,step2_complete,Blocking checkpoint pattern mastered
